[
  {"case_id": "sparse-unauthorized", "retriever": "SPARSE", "checkpoint": "RETRIEVAL", "authorized": false, "tenant_matches": true, "document_active": true, "policy_version_matches": true, "evidence_valid": false, "exposures": {"search_response": false, "cache": false, "trace_body": false, "prompt": false, "citation": false}},
  {"case_id": "dense-wrong-tenant", "retriever": "DENSE", "checkpoint": "RETRIEVAL", "authorized": true, "tenant_matches": false, "document_active": true, "policy_version_matches": true, "evidence_valid": false, "exposures": {"search_response": false, "cache": false, "trace_body": false, "prompt": false, "citation": false}},
  {"case_id": "hybrid-revoked-before-generation", "retriever": "HYBRID", "checkpoint": "PRE_GENERATION", "authorized": false, "tenant_matches": true, "document_active": true, "policy_version_matches": false, "evidence_valid": false, "exposures": {"search_response": false, "cache": false, "trace_body": false, "prompt": false, "citation": false}},
  {"case_id": "filtered-ann-deleted-before-cache", "retriever": "FILTERED_ANN", "checkpoint": "PRE_CACHE_OR_OUTPUT", "authorized": true, "tenant_matches": true, "document_active": false, "policy_version_matches": true, "evidence_valid": false, "exposures": {"search_response": false, "cache": false, "trace_body": false, "prompt": false, "citation": false}},
  {"case_id": "authorized-current", "retriever": "HYBRID", "checkpoint": "PRE_CACHE_OR_OUTPUT", "authorized": true, "tenant_matches": true, "document_active": true, "policy_version_matches": true, "evidence_valid": true, "exposures": {"search_response": true, "cache": true, "trace_body": true, "prompt": true, "citation": true}}
]
